win_id,company,project_name,sector,region,country,subregion,value_usd_m,award_date,client,project_duration_months,esg_compliance,contract_type,completion_status,project_scale,description
win-20327,cpb contractors,"refinery in indonesia, indonesia",utilities,asia-pacific,indonesia,indonesia,424.53,2024-02-04,corporate,6,water conservation,lump sum,cancelled,medium,"cpb contractors secured a utilities medium-scale contract to build a refinery in indonesia, indonesia. project emphasizes community impact."
win-20328,dragados,"stadium in uae, uae",education,middle east,uae,uae,345.83,2024-03-26,state-owned enterprise,45,green building,unit price,delayed,medium,"dragados secured a education medium-scale contract to build a hospital in uae, uae. project emphasizes community impact."
win-20329,laing o’rourke,"railway in oman, oman",energy,middle east,oman,oman,853.4,2025-01-04,utility company,46,community engagement,fixed-price,cancelled,large,"laing o’rourke secured a energy large-scale contract to build a water treatment plant in oman, oman. project emphasizes community impact."
win-20330,acciona,"warehouse in poland, poland",energy,europe,poland,poland,53.33,2025-01-13,state-owned enterprise,41,community engagement,cost-plus,delayed,small,"acciona secured a energy small-scale contract to build a bridge in poland, poland. project emphasizes sustainability."
win-20331,snc-lavalin,"stadium in uae, uae",utilities,middle east,uae,uae,169.59,2021-08-09,corporate,60,community engagement,fixed-price,on track,medium,"snc-lavalin secured a utilities medium-scale contract to build a dam in uae, uae. project emphasizes sustainability."
win-20332,salini impregilo,"shopping mall in kuwait, kuwait",education,middle east,kuwait,kuwait,255.46,2023-06-19,corporate,40,water conservation,cost-plus,delayed,medium,"salini impregilo secured a education medium-scale contract to build a port in kuwait, kuwait. project emphasizes sustainability."
win-20333,ferrovial,"power plant in shanghai, china",residential,asia-pacific,china,shanghai,330.94,2021-10-13,government,29,carbon neutrality,time and materials,cancelled,medium,"ferrovial secured a residential medium-scale contract to build a wind farm in shanghai, china. project emphasizes community impact."
win-20334,kajima corporation,"wind farm in algeria, algeria",infrastructure,africa,algeria,algeria,148.42,2024-08-23,corporate,39,carbon neutrality,fixed-price,on hold,medium,"kajima corporation secured a infrastructure medium-scale contract to build a airport in algeria, algeria. project emphasizes innovation."
win-20335,skanska,"school in algeria, algeria",commercial,africa,algeria,algeria,1608.37,2020-09-08,international agency,76,water conservation,fixed-price,delayed,large,"skanska secured a commercial large-scale contract to build a oil pipeline in algeria, algeria. project emphasizes innovation."
win-20336,bam group,"residential complex in british columbia, canada",education,north america,canada,british columbia,2702.46,2021-07-04,utility company,45,unknown,cost-plus,completed,mega,"bam group secured a education mega-scale contract to build a school in british columbia, canada. project emphasizes sustainability."
win-20337,leighton asia,"solar plant in oman, oman",energy,middle east,oman,oman,38.61,2020-12-23,utility company,37,waste reduction,lump sum,on hold,small,"leighton asia secured a energy small-scale contract to build a highway in oman, oman. project emphasizes community impact."
win-20338,bechtel,"port in saudi arabia, saudi arabia",education,middle east,saudi arabia,saudi arabia,1409.76,2024-06-16,corporate,68,renewable energy,lump sum,cancelled,large,"bechtel secured a education large-scale contract to build a high-rise building in saudi arabia, saudi arabia. project emphasizes innovation."
win-20339,john holland,"school in qatar, qatar",commercial,middle east,qatar,qatar,1010.77,2022-03-26,municipality,67,green building,fixed-price,on track,large,"john holland secured a commercial large-scale contract to build a oil pipeline in qatar, qatar. project emphasizes sustainability."
win-20340,kajima corporation,"hospital in uae, uae",infrastructure,middle east,uae,uae,3386.15,2024-06-05,municipality,28,green building,fixed-price,on track,mega,"kajima corporation secured a infrastructure mega-scale contract to build a warehouse in uae, uae. project emphasizes sustainability."
win-20341,laing o’rourke,"solar plant in oman, oman",education,middle east,oman,oman,6024.6849999999995,2025-01-09,international agency,53,unknown,cost-plus,on track,mega,"laing o’rourke secured a education mega-scale contract to build a residential complex in oman, oman. project emphasizes sustainability."
win-20342,pcl construction,"bridge in egypt, egypt",commercial,africa,egypt,egypt,6024.6849999999995,2024-04-02,ngo,37,unknown,unit price,completed,mega,"pcl construction secured a commercial mega-scale contract to build a solar plant in egypt, egypt. project emphasizes digitalization."
win-20343,aecom,"oil pipeline in são paulo, brazil",healthcare,latin america,brazil,são paulo,1799.85,2022-04-07,government,59,waste reduction,unit price,cancelled,large,"aecom secured a healthcare large-scale contract to build a metro system in são paulo, brazil. project emphasizes community impact."
win-20344,kiewit,"dam in new south wales, australia",healthcare,australia,australia,new south wales,268.84,2021-04-20,state-owned enterprise,64,renewable energy,cost-plus,delayed,medium,"kiewit secured a healthcare medium-scale contract to build a residential complex in new south wales, australia. project emphasizes digitalization."
win-20345,bam group,"airport in chile, chile",education,latin america,chile,chile,6024.6849999999995,2024-08-11,ngo,61,community engagement,lump sum,on hold,mega,"bam group secured a education mega-scale contract to build a railway in chile, chile. project emphasizes digitalization."
win-20346,acciona,"stadium in chile, chile",industrial,latin america,chile,chile,134.02,2024-11-19,municipality,26,green building,lump sum,delayed,medium,"acciona secured a industrial medium-scale contract to build a university campus in chile, chile. project emphasizes digitalization."
win-20347,bouygues,"railway in peru, peru",energy,latin america,peru,peru,66.27,2021-12-18,municipality,68,waste reduction,unit price,on track,small,"bouygues secured a energy small-scale contract to build a bridge in peru, peru. project emphasizes safety."
win-20348,samsung c&t,"refinery in alberta, canada",transportation,north america,canada,alberta,1305.91,2020-08-18,utility company,28,water conservation,time and materials,on track,large,"samsung c&t secured a transportation large-scale contract to build a solar plant in alberta, canada. project emphasizes innovation."
win-20349,snc-lavalin,"power plant in alberta, canada",energy,north america,canada,alberta,3458.98,2023-05-14,ngo,56,community engagement,fixed-price,completed,mega,"snc-lavalin secured a energy mega-scale contract to build a highway in alberta, canada. project emphasizes sustainability."
win-20350,aecom,"high-rise building in sweden, sweden",transportation,europe,sweden,sweden,3706.78,2022-11-28,corporate,54,green building,cost-plus,delayed,mega,"aecom secured a transportation mega-scale contract to build a airport in sweden, sweden. project emphasizes community impact."
win-20351,skanska,"highway in california, usa",infrastructure,north america,usa,california,6024.6849999999995,2022-08-20,state-owned enterprise,29,community engagement,cost-plus,on hold,mega,"skanska secured a infrastructure mega-scale contract to build a hospital in california, usa. project emphasizes community impact."
win-20352,mace group,"shopping mall in kuwait, kuwait",transportation,middle east,kuwait,kuwait,965.41,2025-02-19,corporate,39,water conservation,cost-plus,on track,large,"mace group secured a transportation large-scale contract to build a power plant in kuwait, kuwait. project emphasizes innovation."
win-20353,fluor,"power plant in queensland, australia",residential,australia,australia,queensland,167.12,2020-10-12,ngo,11,community engagement,lump sum,cancelled,medium,"fluor secured a residential medium-scale contract to build a water treatment plant in queensland, australia. project emphasizes innovation."
win-20354,acciona,"power plant in western australia, australia",residential,australia,australia,western australia,325.7,2022-12-29,state-owned enterprise,9,carbon neutrality,time and materials,on hold,medium,"acciona secured a residential medium-scale contract to build a water treatment plant in western australia, australia. project emphasizes innovation."
win-20355,gilbane,"oil pipeline in kenya, kenya",energy,africa,kenya,kenya,2472.95,2024-12-31,municipality,44,waste reduction,cost-plus,on track,mega,"gilbane secured a energy mega-scale contract to build a railway in kenya, kenya. project emphasizes innovation."
win-20356,clark construction,"water treatment plant in sweden, sweden",education,europe,sweden,sweden,42.15,2022-10-07,corporate,11,waste reduction,lump sum,cancelled,small,"clark construction secured a education small-scale contract to build a highway in sweden, sweden. project emphasizes digitalization."
win-20357,whiting-turner,"dam in western australia, australia",energy,australia,australia,western australia,1742.17,2020-11-25,municipality,56,renewable energy,fixed-price,on hold,large,"whiting-turner secured a energy large-scale contract to build a power plant in western australia, australia. project emphasizes digitalization."
win-20358,gilbane,"university campus in chile, chile",transportation,latin america,chile,chile,1894.32,2021-04-17,international agency,18,water conservation,unit price,on track,large,"gilbane secured a transportation large-scale contract to build a residential complex in chile, chile. project emphasizes safety."
win-20359,kajima corporation,"university campus in victoria, australia",industrial,australia,australia,victoria,3273.09,2021-11-04,international agency,21,green building,cost-plus,delayed,mega,"kajima corporation secured a industrial mega-scale contract to build a data center in victoria, australia. project emphasizes digitalization."
win-20360,bouygues,"warehouse in mexico, mexico",healthcare,north america,mexico,mexico,3606.92,2023-06-06,international agency,78,waste reduction,time and materials,completed,mega,"bouygues secured a healthcare mega-scale contract to build a solar plant in mexico, mexico. project emphasizes digitalization."
win-20361,hyundai e&c,"shopping mall in saudi arabia, saudi arabia",education,middle east,saudi arabia,saudi arabia,2915.94,2022-10-23,municipality,28,renewable energy,time and materials,completed,mega,"hyundai e&c secured a education mega-scale contract to build a solar plant in saudi arabia, saudi arabia. project emphasizes community impact."
win-20362,obayashi corporation,"solar plant in beijing, china",healthcare,asia-pacific,china,beijing,1807.1,2022-01-08,international agency,49,green building,cost-plus,on hold,large,"obayashi corporation secured a healthcare large-scale contract to build a solar plant in beijing, china. project emphasizes innovation."
win-20363,whiting-turner,"metro system in peru, peru",education,latin america,peru,peru,1900.9,2023-12-03,utility company,29,green building,cost-plus,completed,large,"whiting-turner secured a education large-scale contract to build a oil pipeline in peru, peru. project emphasizes digitalization."
win-20364,leighton asia,"data center in morocco, morocco",education,africa,morocco,morocco,161.74,2024-05-21,private developer,19,waste reduction,unit price,delayed,medium,"leighton asia secured a education medium-scale contract to build a wind farm in morocco, morocco. project emphasizes community impact."
win-20365,dragados,"airport in indonesia, indonesia",education,asia-pacific,indonesia,indonesia,400.44,2023-10-11,ngo,29,renewable energy,fixed-price,completed,medium,"dragados secured a education medium-scale contract to build a highway in indonesia, indonesia. project emphasizes sustainability."
win-20366,cpb contractors,"stadium in venezuela, venezuela",utilities,latin america,venezuela,venezuela,1550.12,2023-02-10,ngo,8,unknown,time and materials,delayed,large,"cpb contractors secured a utilities large-scale contract to build a school in venezuela, venezuela. project emphasizes innovation."
win-20367,hochtief,"airport in indonesia, indonesia",residential,asia-pacific,indonesia,indonesia,3867.88,2020-06-21,ngo,42,renewable energy,cost-plus,cancelled,mega,"hochtief secured a residential mega-scale contract to build a shopping mall in indonesia, indonesia. project emphasizes community impact."
win-20368,whiting-turner,"bridge in indonesia, indonesia",residential,asia-pacific,indonesia,indonesia,63.6,2024-11-16,state-owned enterprise,6,carbon neutrality,lump sum,on track,small,"whiting-turner secured a residential small-scale contract to build a school in indonesia, indonesia. project emphasizes sustainability."
win-20369,hyundai e&c,"wind farm in shanghai, china",residential,asia-pacific,china,shanghai,48.11,2022-02-23,private developer,45,green building,unit price,on track,small,"hyundai e&c secured a residential small-scale contract to build a solar plant in shanghai, china. project emphasizes sustainability."
win-20370,balfour beatty,"water treatment plant in malaysia, malaysia",education,asia-pacific,malaysia,malaysia,287.81,2023-12-20,ngo,79,green building,lump sum,on hold,medium,"balfour beatty secured a education medium-scale contract to build a oil pipeline in malaysia, malaysia. project emphasizes digitalization."
win-20371,mccarthy,"power plant in kenya, kenya",energy,africa,kenya,kenya,502.97,2023-11-11,state-owned enterprise,45,waste reduction,cost-plus,cancelled,large,"mccarthy secured a energy large-scale contract to build a highway in kenya, kenya. project emphasizes digitalization."
win-20372,acciona,"metro system in oman, oman",energy,middle east,oman,oman,1311.11,2022-08-11,corporate,56,waste reduction,lump sum,cancelled,large,"acciona secured a energy large-scale contract to build a airport in oman, oman. project emphasizes community impact."
win-20373,strabag,"power plant in new south wales, australia",residential,australia,australia,new south wales,3980.53,2022-09-20,private developer,68,renewable energy,time and materials,delayed,mega,"strabag secured a residential mega-scale contract to build a power plant in new south wales, australia. project emphasizes digitalization."
win-20374,china state construction,"residential complex in venezuela, venezuela",infrastructure,latin america,venezuela,venezuela,282.07,2020-08-17,corporate,33,green building,fixed-price,delayed,medium,"china state construction secured a infrastructure medium-scale contract to build a high-rise building in venezuela, venezuela. project emphasizes sustainability."
win-20375,acciona,"water treatment plant in south korea, south korea",utilities,asia-pacific,south korea,south korea,191.9,2023-05-10,public-private partnership,48,water conservation,fixed-price,delayed,medium,"acciona secured a utilities medium-scale contract to build a port in south korea, south korea. project emphasizes community impact."
win-20376,aecom,"data center in kenya, kenya",commercial,africa,kenya,kenya,719.33,2021-03-15,international agency,37,green building,cost-plus,on hold,large,"aecom secured a commercial large-scale contract to build a smart city in kenya, kenya. project emphasizes innovation."
win-20377,bam group,"shopping mall in kuwait, kuwait",utilities,middle east,kuwait,kuwait,596.43,2025-04-25,ngo,53,waste reduction,lump sum,on track,large,"bam group secured a utilities large-scale contract to build a dam in kuwait, kuwait. project emphasizes sustainability."
win-20378,bouygues,"school in colombia, colombia",energy,latin america,colombia,colombia,6024.6849999999995,2024-09-05,government,7,carbon neutrality,unit price,cancelled,mega,"bouygues secured a energy mega-scale contract to build a university campus in colombia, colombia. project emphasizes sustainability."
win-20379,thiess,"residential complex in nigeria, nigeria",utilities,africa,nigeria,nigeria,6024.6849999999995,2023-01-04,state-owned enterprise,71,community engagement,time and materials,completed,mega,"thiess secured a utilities mega-scale contract to build a metro system in nigeria, nigeria. project emphasizes community impact."
win-20380,jacobs,"hospital in japan, japan",transportation,asia-pacific,japan,japan,379.04,2023-04-19,utility company,8,community engagement,time and materials,on hold,medium,"jacobs secured a transportation medium-scale contract to build a high-rise building in japan, japan. project emphasizes sustainability."
win-20381,hyundai e&c,"residential complex in algeria, algeria",education,africa,algeria,algeria,5515.21,2025-03-18,international agency,44,unknown,fixed-price,on track,mega,"hyundai e&c secured a education mega-scale contract to build a airport in algeria, algeria. project emphasizes innovation."
win-20382,mccarthy,"stadium in shanghai, china",commercial,asia-pacific,china,shanghai,1677.92,2024-04-17,corporate,25,renewable energy,cost-plus,completed,large,"mccarthy secured a commercial large-scale contract to build a data center in shanghai, china. project emphasizes digitalization."
win-20383,whiting-turner,"airport in morocco, morocco",industrial,africa,morocco,morocco,1689.87,2025-04-01,international agency,33,carbon neutrality,fixed-price,on track,large,"whiting-turner secured a industrial large-scale contract to build a high-rise building in morocco, morocco. project emphasizes innovation."
win-20384,thiess,"wind farm in georgia, usa",commercial,north america,usa,georgia,278.69,2020-08-04,public-private partnership,12,water conservation,unit price,cancelled,medium,"thiess secured a commercial medium-scale contract to build a port in georgia, usa. project emphasizes safety."
win-20385,clark construction,"power plant in rio de janeiro, brazil",utilities,latin america,brazil,rio de janeiro,460.56,2025-04-07,municipality,35,green building,fixed-price,cancelled,medium,"clark construction secured a utilities medium-scale contract to build a university campus in rio de janeiro, brazil. project emphasizes safety."
win-20386,thiess,"oil pipeline in kuwait, kuwait",education,middle east,kuwait,kuwait,6024.6849999999995,2023-08-17,utility company,27,water conservation,time and materials,on hold,mega,"thiess secured a education mega-scale contract to build a school in kuwait, kuwait. project emphasizes community impact."
win-20387,jacobs,"shopping mall in gauteng, south africa",residential,africa,south africa,gauteng,840.03,2020-11-21,private developer,6,unknown,fixed-price,cancelled,large,"jacobs secured a residential large-scale contract to build a university campus in gauteng, south africa. project emphasizes digitalization."
win-20388,lendlease,"data center in chile, chile",infrastructure,latin america,chile,chile,6024.6849999999995,2024-07-21,government,74,renewable energy,unit price,delayed,mega,"lendlease secured a infrastructure mega-scale contract to build a shopping mall in chile, chile. project emphasizes innovation."
win-20389,lendlease,"water treatment plant in japan, japan",infrastructure,asia-pacific,japan,japan,34.81,2021-02-21,private developer,69,carbon neutrality,time and materials,on hold,small,"lendlease secured a infrastructure small-scale contract to build a residential complex in japan, japan. project emphasizes digitalization."
win-20390,lendlease,"solar plant in kenya, kenya",healthcare,africa,kenya,kenya,295.28,2022-05-09,ngo,19,waste reduction,lump sum,cancelled,medium,"lendlease secured a healthcare medium-scale contract to build a warehouse in kenya, kenya. project emphasizes innovation."
win-20391,gilbane,"water treatment plant in venezuela, venezuela",healthcare,latin america,venezuela,venezuela,90.08,2023-04-17,state-owned enterprise,79,waste reduction,unit price,on track,small,"gilbane secured a healthcare small-scale contract to build a oil pipeline in venezuela, venezuela. project emphasizes digitalization."
win-20392,hyundai e&c,"railway in uae, uae",transportation,middle east,uae,uae,57.01,2020-10-17,ngo,62,water conservation,cost-plus,cancelled,small,"hyundai e&c secured a transportation small-scale contract to build a solar plant in uae, uae. project emphasizes community impact."
win-20393,thiess,"warehouse in venezuela, venezuela",transportation,latin america,venezuela,venezuela,526.13,2023-10-27,utility company,82,carbon neutrality,lump sum,delayed,large,"thiess secured a transportation large-scale contract to build a school in venezuela, venezuela. project emphasizes sustainability."
win-20394,bechtel,"high-rise building in kenya, kenya",education,africa,kenya,kenya,1613.21,2022-07-24,corporate,24,water conservation,unit price,delayed,large,"bechtel secured a education large-scale contract to build a railway in kenya, kenya. project emphasizes community impact."
win-20395,samsung c&t,"warehouse in uae, uae",education,middle east,uae,uae,4774.6,2021-06-01,private developer,13,waste reduction,lump sum,completed,mega,"samsung c&t secured a education mega-scale contract to build a airport in uae, uae. project emphasizes community impact."
win-20396,vinci,"railway in mexico, mexico",utilities,north america,mexico,mexico,492.12,2024-09-07,private developer,22,water conservation,cost-plus,on track,medium,"vinci secured a utilities medium-scale contract to build a port in mexico, mexico. project emphasizes digitalization."
win-20397,clark construction,"shopping mall in kenya, kenya",utilities,africa,kenya,kenya,20.82,2025-03-15,public-private partnership,31,unknown,cost-plus,completed,small,"clark construction secured a utilities small-scale contract to build a hospital in kenya, kenya. project emphasizes community impact."
win-20398,multiplex,"high-rise building in argentina, argentina",utilities,latin america,argentina,argentina,5466.95,2022-04-02,ngo,62,green building,time and materials,cancelled,mega,"multiplex secured a utilities mega-scale contract to build a port in argentina, argentina. project emphasizes community impact."
win-20399,snc-lavalin,"smart city in south korea, south korea",infrastructure,asia-pacific,south korea,south korea,833.28,2025-02-04,private developer,26,water conservation,fixed-price,cancelled,large,"snc-lavalin secured a infrastructure large-scale contract to build a port in south korea, south korea. project emphasizes community impact."
win-20400,pcl construction,"data center in são paulo, brazil",residential,latin america,brazil,são paulo,78.04,2022-09-14,ngo,30,water conservation,time and materials,on hold,small,"pcl construction secured a residential small-scale contract to build a railway in são paulo, brazil. project emphasizes community impact."
win-20401,acciona,"refinery in saudi arabia, saudi arabia",energy,middle east,saudi arabia,saudi arabia,374.12,2023-06-28,utility company,28,community engagement,fixed-price,on hold,medium,"acciona secured a energy medium-scale contract to build a high-rise building in saudi arabia, saudi arabia. project emphasizes innovation."
win-20402,vinci,"data center in colombia, colombia",education,latin america,colombia,colombia,215.07,2023-03-31,municipality,6,community engagement,cost-plus,completed,medium,"vinci secured a education medium-scale contract to build a high-rise building in colombia, colombia. project emphasizes community impact."
win-20403,snc-lavalin,"port in italy, italy",infrastructure,europe,italy,italy,489.74,2021-08-10,state-owned enterprise,46,water conservation,lump sum,completed,medium,"snc-lavalin secured a infrastructure medium-scale contract to build a metro system in italy, italy. project emphasizes safety."
win-20404,skanska,"smart city in malaysia, malaysia",industrial,asia-pacific,malaysia,malaysia,413.57,2024-11-30,government,72,community engagement,lump sum,completed,medium,"skanska secured a industrial medium-scale contract to build a bridge in malaysia, malaysia. project emphasizes safety."
win-20405,clark construction,"residential complex in nigeria, nigeria",residential,africa,nigeria,nigeria,30.83,2023-06-19,private developer,54,waste reduction,unit price,cancelled,small,"clark construction secured a residential small-scale contract to build a bridge in nigeria, nigeria. project emphasizes safety."
win-20406,china state construction,"school in new south wales, australia",transportation,asia-pacific,australia,new south wales,2591.05,2020-10-03,private developer,52,carbon neutrality,cost-plus,completed,mega,"china state construction secured a transportation mega-scale contract to build a dam in new south wales, australia. project emphasizes sustainability."
win-20407,aecom,"water treatment plant in japan, japan",education,asia-pacific,japan,japan,1121.82,2020-08-15,international agency,32,community engagement,cost-plus,cancelled,large,"aecom secured a education large-scale contract to build a residential complex in japan, japan. project emphasizes safety."
win-20408,fluor,"shopping mall in texas, usa",infrastructure,north america,usa,texas,6024.6849999999995,2022-04-03,government,16,waste reduction,fixed-price,completed,mega,"fluor secured a infrastructure mega-scale contract to build a school in texas, usa. project emphasizes sustainability."
win-20409,vinci,"airport in western cape, south africa",industrial,africa,south africa,western cape,476.8,2022-12-23,public-private partnership,65,water conservation,time and materials,on hold,medium,"vinci secured a industrial medium-scale contract to build a school in western cape, south africa. project emphasizes innovation."
