win_id,company,project_name,sector,region,country,subregion,value_usd_m,award_date,client,project_duration_months,esg_compliance,contract_type,completion_status,project_scale,description
win-21066,vinci,"water treatment plant in western australia, australia",transportation,australia,australia,western australia,6024.6849999999995,2022-11-13,international agency,34,renewable energy,unit price,completed,mega,"vinci secured a transportation mega-scale contract to build a metro system in western australia, australia. project emphasizes innovation."
win-21067,samsung c&t,"warehouse in kenya, kenya",commercial,africa,kenya,kenya,193.03,2022-04-06,utility company,13,renewable energy,time and materials,completed,medium,"samsung c&t secured a commercial medium-scale contract to build a wind farm in kenya, kenya. project emphasizes community impact."
win-21068,turner construction,"water treatment plant in victoria, australia",healthcare,australia,australia,victoria,1273.81,2020-08-08,utility company,68,carbon neutrality,cost-plus,on track,large,"turner construction secured a healthcare large-scale contract to build a stadium in victoria, australia. project emphasizes safety."
win-21069,china state construction,"port in british columbia, canada",utilities,north america,canada,british columbia,242.58,2022-06-29,government,49,community engagement,lump sum,cancelled,medium,"china state construction secured a utilities medium-scale contract to build a university campus in british columbia, canada. project emphasizes community impact."
win-21070,turner construction,"power plant in victoria, australia",industrial,australia,australia,victoria,29.83,2023-08-30,corporate,27,waste reduction,unit price,cancelled,small,"turner construction secured a industrial small-scale contract to build a high-rise building in victoria, australia. project emphasizes safety."
win-21071,turner construction,"wind farm in oman, oman",utilities,middle east,oman,oman,267.23,2021-10-06,utility company,17,waste reduction,fixed-price,delayed,medium,"turner construction secured a utilities medium-scale contract to build a data center in oman, oman. project emphasizes sustainability."
win-21072,leighton asia,"smart city in poland, poland",energy,europe,poland,poland,1542.06,2024-12-11,international agency,71,water conservation,fixed-price,completed,large,"leighton asia secured a energy large-scale contract to build a wind farm in poland, poland. project emphasizes community impact."
win-21073,balfour beatty,"high-rise building in mexico, mexico",residential,north america,mexico,mexico,798.99,2020-09-02,private developer,49,waste reduction,time and materials,on track,large,"balfour beatty secured a residential large-scale contract to build a hospital in mexico, mexico. project emphasizes digitalization."
win-21074,lendlease,"university campus in peru, peru",infrastructure,latin america,peru,peru,488.78,2020-12-05,state-owned enterprise,32,green building,lump sum,delayed,medium,"lendlease secured a infrastructure medium-scale contract to build a power plant in peru, peru. project emphasizes community impact."
win-21075,thiess,"airport in rio de janeiro, brazil",energy,latin america,brazil,rio de janeiro,1081.34,2024-11-12,state-owned enterprise,35,community engagement,fixed-price,cancelled,large,"thiess secured a energy large-scale contract to build a stadium in rio de janeiro, brazil. project emphasizes innovation."
win-21076,mace group,"residential complex in ontario, canada",utilities,north america,canada,ontario,10.44,2024-08-26,private developer,65,green building,time and materials,cancelled,small,"mace group secured a utilities small-scale contract to build a refinery in ontario, canada. project emphasizes safety."
win-21077,john holland,"refinery in italy, italy",healthcare,europe,italy,italy,1023.97,2025-03-05,state-owned enterprise,40,water conservation,fixed-price,delayed,large,"john holland secured a healthcare large-scale contract to build a wind farm in italy, italy. project emphasizes safety."
win-21078,mortenson construction,"port in singapore, singapore",utilities,asia-pacific,singapore,singapore,52.51,2022-05-16,state-owned enterprise,70,unknown,time and materials,cancelled,small,"mortenson construction secured a utilities small-scale contract to build a shopping mall in singapore, singapore. project emphasizes safety."
win-21079,multiplex,"stadium in south korea, south korea",transportation,asia-pacific,south korea,south korea,15.21,2021-12-30,international agency,47,waste reduction,time and materials,cancelled,small,"multiplex secured a transportation small-scale contract to build a oil pipeline in south korea, south korea. project emphasizes safety."
win-21080,leighton asia,"shopping mall in kenya, kenya",healthcare,africa,kenya,kenya,131.38,2023-10-07,private developer,39,community engagement,time and materials,completed,medium,"leighton asia secured a healthcare medium-scale contract to build a airport in kenya, kenya. project emphasizes digitalization."
win-21081,thiess,"shopping mall in maharashtra, india",infrastructure,asia-pacific,india,maharashtra,1351.9,2021-08-09,ngo,45,waste reduction,fixed-price,completed,large,"thiess secured a infrastructure large-scale contract to build a refinery in maharashtra, india. project emphasizes innovation."
win-21082,mortenson construction,"high-rise building in singapore, singapore",education,asia-pacific,singapore,singapore,440.8,2021-01-27,public-private partnership,67,water conservation,time and materials,on hold,medium,"mortenson construction secured a education medium-scale contract to build a bridge in singapore, singapore. project emphasizes community impact."
win-21083,strabag,"oil pipeline in queensland, australia",utilities,asia-pacific,australia,queensland,373.51,2024-05-05,government,15,water conservation,fixed-price,completed,medium,"strabag secured a utilities medium-scale contract to build a dam in queensland, australia. project emphasizes safety."
win-21084,laing o’rourke,"dam in uae, uae",energy,middle east,uae,uae,1727.17,2024-09-04,international agency,45,water conservation,time and materials,completed,large,"laing o’rourke secured a energy large-scale contract to build a warehouse in uae, uae. project emphasizes innovation."
win-21085,salini impregilo,"university campus in uae, uae",education,middle east,uae,uae,3521.97,2024-08-04,corporate,54,waste reduction,time and materials,on track,mega,"salini impregilo secured a education mega-scale contract to build a residential complex in uae, uae. project emphasizes digitalization."
win-21086,balfour beatty,"data center in poland, poland",education,europe,poland,poland,77.42,2021-10-12,international agency,6,water conservation,unit price,on track,small,"balfour beatty secured a education small-scale contract to build a bridge in poland, poland. project emphasizes innovation."
win-21087,thiess,"dam in victoria, australia",healthcare,asia-pacific,australia,victoria,89.57,2023-01-29,public-private partnership,44,green building,cost-plus,on track,small,"thiess secured a healthcare small-scale contract to build a school in victoria, australia. project emphasizes safety."
win-21088,kiewit,"high-rise building in british columbia, canada",industrial,north america,canada,british columbia,2438.86,2024-07-14,private developer,47,water conservation,unit price,cancelled,mega,"kiewit secured a industrial mega-scale contract to build a hospital in british columbia, canada. project emphasizes innovation."
win-21089,mortenson construction,"airport in indonesia, indonesia",industrial,asia-pacific,indonesia,indonesia,1601.04,2025-05-18,private developer,62,green building,lump sum,on hold,large,"mortenson construction secured a industrial large-scale contract to build a residential complex in indonesia, indonesia. project emphasizes safety."
win-21090,mccarthy,"port in new south wales, australia",infrastructure,australia,australia,new south wales,52.95,2022-06-09,utility company,42,carbon neutrality,cost-plus,delayed,small,"mccarthy secured a infrastructure small-scale contract to build a warehouse in new south wales, australia. project emphasizes innovation."
win-21091,strabag,"oil pipeline in colombia, colombia",healthcare,latin america,colombia,colombia,101.43,2024-12-01,international agency,59,water conservation,time and materials,cancelled,medium,"strabag secured a healthcare medium-scale contract to build a wind farm in colombia, colombia. project emphasizes innovation."
win-21092,whiting-turner,"highway in new south wales, australia",industrial,asia-pacific,australia,new south wales,74.65,2021-05-09,utility company,27,water conservation,cost-plus,delayed,small,"whiting-turner secured a industrial small-scale contract to build a highway in new south wales, australia. project emphasizes innovation."
win-21093,laing o’rourke,"port in california, usa",commercial,north america,usa,california,1569.99,2021-02-13,public-private partnership,64,unknown,time and materials,delayed,large,"laing o’rourke secured a commercial large-scale contract to build a high-rise building in california, usa. project emphasizes innovation."
win-21094,leighton asia,"residential complex in algeria, algeria",industrial,africa,algeria,algeria,4304.27,2021-02-19,ngo,15,community engagement,unit price,delayed,mega,"leighton asia secured a industrial mega-scale contract to build a solar plant in algeria, algeria. project emphasizes digitalization."
win-21095,shimizu corporation,"solar plant in saudi arabia, saudi arabia",infrastructure,middle east,saudi arabia,saudi arabia,1825.56,2023-01-26,utility company,6,water conservation,unit price,delayed,large,"shimizu corporation secured a infrastructure large-scale contract to build a highway in saudi arabia, saudi arabia. project emphasizes safety."
win-21096,lendlease,"residential complex in florida, usa",infrastructure,north america,usa,florida,279.4,2023-03-02,government,73,waste reduction,lump sum,delayed,medium,"lendlease secured a infrastructure medium-scale contract to build a highway in florida, usa. project emphasizes sustainability."
win-21097,aecom,"warehouse in oman, oman",residential,middle east,oman,oman,236.05,2022-03-13,municipality,15,community engagement,time and materials,cancelled,medium,"aecom secured a residential medium-scale contract to build a residential complex in oman, oman. project emphasizes digitalization."
win-21098,salini impregilo,"hospital in scotland, uk",utilities,europe,uk,scotland,3324.13,2025-01-10,utility company,47,renewable energy,fixed-price,delayed,mega,"salini impregilo secured a utilities mega-scale contract to build a bridge in scotland, uk. project emphasizes sustainability."
win-21099,bam group,"high-rise building in indonesia, indonesia",healthcare,asia-pacific,indonesia,indonesia,25.58,2020-11-23,utility company,57,unknown,time and materials,cancelled,small,"bam group secured a healthcare small-scale contract to build a solar plant in indonesia, indonesia. project emphasizes digitalization."
win-21100,multiplex,"oil pipeline in new york, usa",healthcare,north america,usa,new york,1067.63,2020-10-14,public-private partnership,78,waste reduction,unit price,on hold,large,"multiplex secured a healthcare large-scale contract to build a university campus in new york, usa. project emphasizes sustainability."
win-21101,larsen & toubro,"solar plant in new south wales, australia",utilities,australia,australia,new south wales,191.06,2020-09-25,government,41,waste reduction,unit price,delayed,medium,"larsen & toubro secured a utilities medium-scale contract to build a metro system in new south wales, australia. project emphasizes safety."
win-21102,ferrovial,"wind farm in oman, oman",education,middle east,oman,oman,117.56,2024-11-23,corporate,76,waste reduction,cost-plus,cancelled,medium,"ferrovial secured a education medium-scale contract to build a residential complex in oman, oman. project emphasizes sustainability."
win-21103,laing o’rourke,"highway in argentina, argentina",healthcare,latin america,argentina,argentina,38.21,2020-08-24,state-owned enterprise,47,carbon neutrality,lump sum,completed,small,"laing o’rourke secured a healthcare small-scale contract to build a solar plant in argentina, argentina. project emphasizes digitalization."
win-21104,bouygues,"stadium in delhi, india",infrastructure,asia-pacific,india,delhi,3073.83,2022-04-26,ngo,50,green building,time and materials,delayed,mega,"bouygues secured a infrastructure mega-scale contract to build a water treatment plant in delhi, india. project emphasizes digitalization."
win-21105,saipem,"shopping mall in gauteng, south africa",industrial,africa,south africa,gauteng,3556.14,2024-03-13,municipality,9,water conservation,unit price,delayed,mega,"saipem secured a industrial mega-scale contract to build a refinery in gauteng, south africa. project emphasizes innovation."
win-21106,samsung c&t,"high-rise building in sweden, sweden",infrastructure,europe,sweden,sweden,1886.85,2023-04-07,municipality,30,renewable energy,cost-plus,delayed,large,"samsung c&t secured a infrastructure large-scale contract to build a airport in sweden, sweden. project emphasizes innovation."
win-21107,clark construction,"university campus in morocco, morocco",education,africa,morocco,morocco,1109.14,2021-09-10,utility company,65,green building,cost-plus,delayed,large,"clark construction secured a education large-scale contract to build a residential complex in morocco, morocco. project emphasizes safety."
win-21108,mace group,"school in quebec, canada",energy,north america,canada,quebec,6024.6849999999995,2022-08-30,government,39,green building,time and materials,on track,mega,"mace group secured a energy mega-scale contract to build a highway in quebec, canada. project emphasizes safety."
win-21109,kiewit,"warehouse in singapore, singapore",education,asia-pacific,singapore,singapore,4626.45,2024-01-15,municipality,36,community engagement,fixed-price,on hold,mega,"kiewit secured a education mega-scale contract to build a data center in singapore, singapore. project emphasizes sustainability."
win-21110,hyundai e&c,"university campus in new south wales, australia",healthcare,australia,australia,new south wales,67.91,2023-12-14,international agency,31,carbon neutrality,time and materials,delayed,small,"hyundai e&c secured a healthcare small-scale contract to build a solar plant in new south wales, australia. project emphasizes digitalization."
win-21111,larsen & toubro,"bridge in south korea, south korea",industrial,asia-pacific,south korea,south korea,1297.93,2020-10-18,private developer,51,waste reduction,time and materials,delayed,large,"larsen & toubro secured a industrial large-scale contract to build a bridge in south korea, south korea. project emphasizes innovation."
win-21112,laing o’rourke,"high-rise building in queensland, australia",energy,australia,australia,queensland,328.41,2022-08-02,government,32,waste reduction,unit price,cancelled,medium,"laing o’rourke secured a energy medium-scale contract to build a power plant in queensland, australia. project emphasizes innovation."
win-21113,vinci,"metro system in shanghai, china",utilities,asia-pacific,china,shanghai,1133.9,2022-03-15,public-private partnership,9,water conservation,time and materials,on hold,large,"vinci secured a utilities large-scale contract to build a university campus in shanghai, china. project emphasizes innovation."
win-21114,multiplex,"refinery in poland, poland",healthcare,europe,poland,poland,6024.6849999999995,2024-03-18,corporate,28,waste reduction,cost-plus,on track,mega,"multiplex secured a healthcare mega-scale contract to build a hospital in poland, poland. project emphasizes sustainability."
win-21115,hochtief,"power plant in uae, uae",education,middle east,uae,uae,135.82,2023-12-03,public-private partnership,21,community engagement,cost-plus,on hold,medium,"hochtief secured a education medium-scale contract to build a high-rise building in uae, uae. project emphasizes safety."
win-21116,gilbane,"university campus in saudi arabia, saudi arabia",commercial,middle east,saudi arabia,saudi arabia,1207.83,2025-04-19,utility company,79,carbon neutrality,time and materials,cancelled,large,"gilbane secured a commercial large-scale contract to build a residential complex in saudi arabia, saudi arabia. project emphasizes digitalization."
win-21117,ferrovial,"water treatment plant in singapore, singapore",residential,asia-pacific,singapore,singapore,349.95,2021-12-06,utility company,6,unknown,lump sum,on hold,medium,"ferrovial secured a residential medium-scale contract to build a port in singapore, singapore. project emphasizes innovation."
win-21118,vinci,"school in colombia, colombia",transportation,latin america,colombia,colombia,73.0,2024-09-18,international agency,62,carbon neutrality,time and materials,on track,small,"vinci secured a transportation small-scale contract to build a shopping mall in colombia, colombia. project emphasizes digitalization."
win-21119,whiting-turner,"highway in new south wales, australia",education,australia,australia,new south wales,88.41,2022-08-09,state-owned enterprise,66,waste reduction,fixed-price,delayed,small,"whiting-turner secured a education small-scale contract to build a highway in new south wales, australia. project emphasizes community impact."
win-21120,vinci,"data center in egypt, egypt",infrastructure,africa,egypt,egypt,69.79,2022-06-24,state-owned enterprise,35,green building,fixed-price,completed,small,"vinci secured a infrastructure small-scale contract to build a hospital in egypt, egypt. project emphasizes safety."
win-21121,whiting-turner,"bridge in egypt, egypt",education,africa,egypt,egypt,356.38,2024-11-25,state-owned enterprise,73,renewable energy,unit price,cancelled,medium,"whiting-turner secured a education medium-scale contract to build a university campus in egypt, egypt. project emphasizes innovation."
win-21122,aecom,"metro system in nigeria, nigeria",healthcare,africa,nigeria,nigeria,1279.64,2023-04-08,private developer,61,water conservation,cost-plus,completed,large,"aecom secured a healthcare large-scale contract to build a data center in nigeria, nigeria. project emphasizes digitalization."
win-21123,bam group,"railway in egypt, egypt",industrial,africa,egypt,egypt,6024.6849999999995,2023-07-03,corporate,52,renewable energy,fixed-price,delayed,mega,"bam group secured a industrial mega-scale contract to build a dam in egypt, egypt. project emphasizes safety."
win-21124,thiess,"warehouse in queensland, australia",education,australia,australia,queensland,39.33,2024-11-22,ngo,63,green building,unit price,on hold,small,"thiess secured a education small-scale contract to build a dam in queensland, australia. project emphasizes sustainability."
win-21125,hochtief,"oil pipeline in argentina, argentina",energy,latin america,argentina,argentina,3574.6,2024-10-16,private developer,76,unknown,fixed-price,cancelled,mega,"hochtief secured a energy mega-scale contract to build a high-rise building in argentina, argentina. project emphasizes safety."
win-21126,ferrovial,"university campus in victoria, australia",industrial,asia-pacific,australia,victoria,834.68,2020-12-29,international agency,74,community engagement,unit price,on hold,large,"ferrovial secured a industrial large-scale contract to build a refinery in victoria, australia. project emphasizes safety."
win-21127,whiting-turner,"data center in oman, oman",healthcare,middle east,oman,oman,6024.6849999999995,2022-10-30,private developer,60,waste reduction,fixed-price,on hold,mega,"whiting-turner secured a healthcare mega-scale contract to build a highway in oman, oman. project emphasizes digitalization."
win-21128,snc-lavalin,"refinery in indonesia, indonesia",healthcare,asia-pacific,indonesia,indonesia,1623.89,2020-10-31,municipality,74,green building,lump sum,completed,large,"snc-lavalin secured a healthcare large-scale contract to build a metro system in indonesia, indonesia. project emphasizes innovation."
win-21129,strabag,"power plant in nigeria, nigeria",energy,africa,nigeria,nigeria,6024.6849999999995,2021-12-29,private developer,58,renewable energy,fixed-price,on track,mega,"strabag secured a energy mega-scale contract to build a refinery in nigeria, nigeria. project emphasizes innovation."
win-21130,samsung c&t,"railway in mexico, mexico",utilities,north america,mexico,mexico,172.66,2022-05-10,utility company,41,waste reduction,fixed-price,completed,medium,"samsung c&t secured a utilities medium-scale contract to build a stadium in mexico, mexico. project emphasizes community impact."
win-21131,turner construction,"port in washington, usa",transportation,north america,usa,washington,5578.75,2025-03-25,public-private partnership,17,waste reduction,cost-plus,on track,mega,"turner construction secured a transportation mega-scale contract to build a warehouse in washington, usa. project emphasizes community impact."
win-21132,skanska,"residential complex in spain, spain",infrastructure,europe,spain,spain,29.73,2021-04-29,state-owned enterprise,18,unknown,fixed-price,on track,small,"skanska secured a infrastructure small-scale contract to build a water treatment plant in spain, spain. project emphasizes digitalization."
win-21133,fluor,"highway in new south wales, australia",utilities,australia,australia,new south wales,6024.6849999999995,2022-12-05,international agency,32,waste reduction,time and materials,delayed,mega,"fluor secured a utilities mega-scale contract to build a power plant in new south wales, australia. project emphasizes community impact."
win-21134,dragados,"solar plant in singapore, singapore",education,asia-pacific,singapore,singapore,133.29,2024-01-15,municipality,20,water conservation,lump sum,delayed,medium,"dragados secured a education medium-scale contract to build a metro system in singapore, singapore. project emphasizes innovation."
win-21135,john holland,"shopping mall in oman, oman",healthcare,middle east,oman,oman,781.85,2021-09-15,corporate,28,green building,lump sum,on hold,large,"john holland secured a healthcare large-scale contract to build a airport in oman, oman. project emphasizes community impact."
win-21136,skanska,"oil pipeline in netherlands, netherlands",utilities,europe,netherlands,netherlands,50.01,2022-05-09,government,26,carbon neutrality,lump sum,delayed,small,"skanska secured a utilities small-scale contract to build a residential complex in netherlands, netherlands. project emphasizes digitalization."
win-21137,john holland,"stadium in alberta, canada",transportation,north america,canada,alberta,92.37,2022-02-05,municipality,56,green building,cost-plus,completed,small,"john holland secured a transportation small-scale contract to build a metro system in alberta, canada. project emphasizes safety."
win-21138,vinci,"water treatment plant in uae, uae",residential,middle east,uae,uae,6024.6849999999995,2021-09-04,public-private partnership,11,green building,lump sum,on hold,mega,"vinci secured a residential mega-scale contract to build a highway in uae, uae. project emphasizes digitalization."
win-21139,china state construction,"port in mexico, mexico",education,north america,mexico,mexico,6024.6849999999995,2022-07-19,utility company,43,waste reduction,unit price,on track,mega,"china state construction secured a education mega-scale contract to build a hospital in mexico, mexico. project emphasizes digitalization."
win-21140,kiewit,"warehouse in new south wales, australia",commercial,australia,australia,new south wales,6024.6849999999995,2022-08-01,government,21,unknown,fixed-price,on track,mega,"kiewit secured a commercial mega-scale contract to build a metro system in new south wales, australia. project emphasizes innovation."
win-21141,snc-lavalin,"dam in nigeria, nigeria",healthcare,africa,nigeria,nigeria,149.78,2024-10-12,ngo,83,community engagement,lump sum,delayed,medium,"snc-lavalin secured a healthcare medium-scale contract to build a water treatment plant in nigeria, nigeria. project emphasizes innovation."
win-21142,larsen & toubro,"solar plant in netherlands, netherlands",infrastructure,europe,netherlands,netherlands,1605.85,2023-01-29,municipality,23,carbon neutrality,fixed-price,delayed,large,"larsen & toubro secured a infrastructure large-scale contract to build a solar plant in netherlands, netherlands. project emphasizes digitalization."
win-21143,salini impregilo,"metro system in quebec, canada",transportation,north america,canada,quebec,734.36,2022-11-18,government,79,waste reduction,lump sum,on hold,large,"salini impregilo secured a transportation large-scale contract to build a bridge in quebec, canada. project emphasizes community impact."
win-21144,kiewit,"railway in new south wales, australia",energy,australia,australia,new south wales,3849.91,2023-03-08,utility company,59,carbon neutrality,time and materials,completed,mega,"kiewit secured a energy mega-scale contract to build a port in new south wales, australia. project emphasizes sustainability."
win-21145,snc-lavalin,"data center in wales, uk",energy,europe,uk,wales,2012.61,2020-09-09,international agency,11,community engagement,lump sum,delayed,mega,"snc-lavalin secured a energy mega-scale contract to build a wind farm in wales, uk. project emphasizes community impact."
win-21146,kajima corporation,"smart city in egypt, egypt",commercial,africa,egypt,egypt,4571.72,2021-09-17,government,36,green building,time and materials,delayed,mega,"kajima corporation secured a commercial mega-scale contract to build a shopping mall in egypt, egypt. project emphasizes community impact."
