win_id,company,project_name,sector,region,country,subregion,value_usd_m,award_date,client,project_duration_months,esg_compliance,contract_type,completion_status,project_scale,description
win-20656,china state construction,"residential complex in northern ireland, uk",infrastructure,europe,uk,northern ireland,34.06,2023-01-08,private developer,36,renewable energy,time and materials,delayed,small,"china state construction secured a infrastructure small-scale contract to build a dam in northern ireland, uk. project emphasizes sustainability."
win-20657,strabag,"dam in morocco, morocco",infrastructure,africa,morocco,morocco,4845.43,2023-05-08,international agency,35,green building,lump sum,on hold,mega,"strabag secured a infrastructure mega-scale contract to build a residential complex in morocco, morocco. project emphasizes safety."
win-20658,multiplex,"airport in egypt, egypt",transportation,africa,egypt,egypt,403.62,2021-02-25,corporate,29,unknown,lump sum,on track,medium,"multiplex secured a transportation medium-scale contract to build a dam in egypt, egypt. project emphasizes safety."
win-20659,vinci,"dam in peru, peru",transportation,latin america,peru,peru,385.36,2024-08-04,ngo,75,community engagement,fixed-price,on track,medium,"vinci secured a transportation medium-scale contract to build a residential complex in peru, peru. project emphasizes safety."
win-20660,mccarthy,"power plant in malaysia, malaysia",healthcare,asia-pacific,malaysia,malaysia,808.37,2024-06-19,government,26,community engagement,fixed-price,on track,large,"mccarthy secured a healthcare large-scale contract to build a high-rise building in malaysia, malaysia. project emphasizes community impact."
win-20661,leighton asia,"oil pipeline in tamil nadu, india",utilities,asia-pacific,india,tamil nadu,1305.55,2025-02-01,utility company,35,water conservation,lump sum,cancelled,large,"leighton asia secured a utilities large-scale contract to build a water treatment plant in tamil nadu, india. project emphasizes digitalization."
win-20662,kiewit,"shopping mall in egypt, egypt",industrial,africa,egypt,egypt,83.98,2020-11-23,international agency,79,waste reduction,lump sum,completed,small,"kiewit secured a industrial small-scale contract to build a university campus in egypt, egypt. project emphasizes community impact."
win-20663,salini impregilo,"dam in france, france",commercial,europe,france,france,316.2,2023-07-11,utility company,22,renewable energy,unit price,on track,medium,"salini impregilo secured a commercial medium-scale contract to build a oil pipeline in france, france. project emphasizes digitalization."
win-20664,hochtief,"school in kenya, kenya",transportation,africa,kenya,kenya,2048.06,2024-09-05,corporate,62,water conservation,unit price,cancelled,mega,"hochtief secured a transportation mega-scale contract to build a solar plant in kenya, kenya. project emphasizes innovation."
win-20665,acciona,"wind farm in singapore, singapore",healthcare,asia-pacific,singapore,singapore,94.18,2023-01-13,international agency,31,waste reduction,fixed-price,delayed,small,"acciona secured a healthcare small-scale contract to build a metro system in singapore, singapore. project emphasizes safety."
win-20666,samsung c&t,"warehouse in argentina, argentina",commercial,latin america,argentina,argentina,3913.61,2020-08-09,corporate,39,green building,time and materials,on track,mega,"samsung c&t secured a commercial mega-scale contract to build a port in argentina, argentina. project emphasizes innovation."
win-20667,bouygues,"power plant in western australia, australia",commercial,australia,australia,western australia,6024.6849999999995,2021-03-18,corporate,18,water conservation,cost-plus,cancelled,mega,"bouygues secured a commercial mega-scale contract to build a warehouse in western australia, australia. project emphasizes sustainability."
win-20668,jacobs,"smart city in new york, usa",transportation,north america,usa,new york,6024.6849999999995,2022-04-27,international agency,37,carbon neutrality,cost-plus,delayed,mega,"jacobs secured a transportation mega-scale contract to build a power plant in new york, usa. project emphasizes sustainability."
win-20669,bechtel,"high-rise building in mexico, mexico",residential,north america,mexico,mexico,5190.72,2022-12-05,corporate,56,unknown,fixed-price,on hold,mega,"bechtel secured a residential mega-scale contract to build a solar plant in mexico, mexico. project emphasizes digitalization."
win-20670,kajima corporation,"water treatment plant in victoria, australia",energy,australia,australia,victoria,61.63,2024-04-01,state-owned enterprise,79,waste reduction,unit price,cancelled,small,"kajima corporation secured a energy small-scale contract to build a power plant in victoria, australia. project emphasizes innovation."
win-20671,cpb contractors,"bridge in shanghai, china",healthcare,asia-pacific,china,shanghai,2689.66,2021-09-25,utility company,45,community engagement,time and materials,on hold,mega,"cpb contractors secured a healthcare mega-scale contract to build a university campus in shanghai, china. project emphasizes sustainability."
win-20672,gilbane,"railway in nigeria, nigeria",energy,africa,nigeria,nigeria,6024.6849999999995,2020-10-14,public-private partnership,39,green building,unit price,completed,mega,"gilbane secured a energy mega-scale contract to build a railway in nigeria, nigeria. project emphasizes safety."
win-20673,mccarthy,"residential complex in indonesia, indonesia",healthcare,asia-pacific,indonesia,indonesia,413.47,2021-08-09,international agency,36,green building,lump sum,delayed,medium,"mccarthy secured a healthcare medium-scale contract to build a stadium in indonesia, indonesia. project emphasizes community impact."
win-20674,multiplex,"railway in western australia, australia",infrastructure,australia,australia,western australia,5740.57,2021-04-14,municipality,63,water conservation,cost-plus,completed,mega,"multiplex secured a infrastructure mega-scale contract to build a residential complex in western australia, australia. project emphasizes safety."
win-20675,larsen & toubro,"bridge in japan, japan",education,asia-pacific,japan,japan,639.07,2024-05-18,private developer,13,green building,fixed-price,completed,large,"larsen & toubro secured a education large-scale contract to build a water treatment plant in japan, japan. project emphasizes community impact."
win-20676,kajima corporation,"university campus in nigeria, nigeria",industrial,africa,nigeria,nigeria,492.55,2025-01-04,public-private partnership,8,green building,lump sum,delayed,medium,"kajima corporation secured a industrial medium-scale contract to build a port in nigeria, nigeria. project emphasizes innovation."
win-20677,turner construction,"highway in kenya, kenya",utilities,africa,kenya,kenya,1596.96,2024-12-25,government,26,water conservation,cost-plus,completed,large,"turner construction secured a utilities large-scale contract to build a wind farm in kenya, kenya. project emphasizes digitalization."
win-20678,hochtief,"smart city in jiangsu, china",transportation,asia-pacific,china,jiangsu,2615.78,2024-03-17,public-private partnership,48,water conservation,time and materials,completed,mega,"hochtief secured a transportation mega-scale contract to build a power plant in jiangsu, china. project emphasizes community impact."
win-20679,thiess,"smart city in illinois, usa",energy,north america,usa,illinois,1945.37,2021-05-23,state-owned enterprise,13,unknown,time and materials,on hold,large,"thiess secured a energy large-scale contract to build a wind farm in illinois, usa. project emphasizes innovation."
win-20680,pcl construction,"university campus in singapore, singapore",commercial,asia-pacific,singapore,singapore,1285.74,2022-11-30,private developer,26,water conservation,unit price,cancelled,large,"pcl construction secured a commercial large-scale contract to build a school in singapore, singapore. project emphasizes community impact."
win-20681,china state construction,"shopping mall in victoria, australia",healthcare,australia,australia,victoria,6024.6849999999995,2020-12-30,state-owned enterprise,13,green building,lump sum,on hold,mega,"china state construction secured a healthcare mega-scale contract to build a stadium in victoria, australia. project emphasizes innovation."
win-20682,salini impregilo,"refinery in qatar, qatar",education,middle east,qatar,qatar,863.66,2023-01-01,government,6,renewable energy,fixed-price,on hold,large,"salini impregilo secured a education large-scale contract to build a hospital in qatar, qatar. project emphasizes community impact."
win-20683,hyundai e&c,"dam in netherlands, netherlands",education,europe,netherlands,netherlands,490.51,2023-08-31,public-private partnership,20,green building,cost-plus,completed,medium,"hyundai e&c secured a education medium-scale contract to build a high-rise building in netherlands, netherlands. project emphasizes safety."
win-20684,snc-lavalin,"oil pipeline in saudi arabia, saudi arabia",energy,middle east,saudi arabia,saudi arabia,5140.51,2022-08-16,government,25,carbon neutrality,unit price,on track,mega,"snc-lavalin secured a energy mega-scale contract to build a residential complex in saudi arabia, saudi arabia. project emphasizes safety."
win-20685,snc-lavalin,"highway in venezuela, venezuela",industrial,latin america,venezuela,venezuela,1926.29,2023-07-14,utility company,26,unknown,lump sum,cancelled,large,"snc-lavalin secured a industrial large-scale contract to build a warehouse in venezuela, venezuela. project emphasizes innovation."
win-20686,bam group,"hospital in northern ireland, uk",energy,europe,uk,northern ireland,6024.6849999999995,2024-07-11,municipality,12,unknown,unit price,cancelled,mega,"bam group secured a energy mega-scale contract to build a school in northern ireland, uk. project emphasizes safety."
win-20687,turner construction,"high-rise building in france, france",residential,europe,france,france,28.46,2021-12-31,ngo,25,water conservation,fixed-price,completed,small,"turner construction secured a residential small-scale contract to build a university campus in france, france. project emphasizes sustainability."
win-20688,gilbane,"oil pipeline in germany, germany",industrial,europe,germany,germany,153.61,2024-03-30,government,56,community engagement,time and materials,completed,medium,"gilbane secured a industrial medium-scale contract to build a solar plant in germany, germany. project emphasizes sustainability."
win-20689,laing o’rourke,"port in delhi, india",industrial,asia-pacific,india,delhi,382.84,2024-01-21,utility company,61,water conservation,cost-plus,cancelled,medium,"laing o’rourke secured a industrial medium-scale contract to build a dam in delhi, india. project emphasizes digitalization."
win-20690,dragados,"dam in victoria, australia",commercial,australia,australia,victoria,840.37,2020-08-23,utility company,32,community engagement,lump sum,completed,large,"dragados secured a commercial large-scale contract to build a shopping mall in victoria, australia. project emphasizes safety."
win-20691,bam group,"high-rise building in south korea, south korea",utilities,asia-pacific,south korea,south korea,333.49,2022-01-09,municipality,15,green building,fixed-price,on track,medium,"bam group secured a utilities medium-scale contract to build a shopping mall in south korea, south korea. project emphasizes digitalization."
win-20692,dragados,"residential complex in japan, japan",energy,asia-pacific,japan,japan,53.68,2022-02-01,municipality,32,waste reduction,cost-plus,delayed,small,"dragados secured a energy small-scale contract to build a residential complex in japan, japan. project emphasizes safety."
win-20693,mace group,"dam in kuwait, kuwait",energy,middle east,kuwait,kuwait,50.65,2021-09-12,public-private partnership,52,green building,cost-plus,cancelled,small,"mace group secured a energy small-scale contract to build a refinery in kuwait, kuwait. project emphasizes community impact."
win-20694,mccarthy,"shopping mall in georgia, usa",energy,north america,usa,georgia,113.8,2020-12-09,private developer,73,unknown,lump sum,delayed,medium,"mccarthy secured a energy medium-scale contract to build a warehouse in georgia, usa. project emphasizes community impact."
win-20695,obayashi corporation,"railway in uae, uae",energy,middle east,uae,uae,259.14,2020-06-26,corporate,84,carbon neutrality,unit price,delayed,medium,"obayashi corporation secured a energy medium-scale contract to build a wind farm in uae, uae. project emphasizes innovation."
win-20696,laing o’rourke,"shopping mall in new south wales, australia",energy,asia-pacific,australia,new south wales,88.44,2022-01-01,government,80,waste reduction,fixed-price,delayed,small,"laing o’rourke secured a energy small-scale contract to build a residential complex in new south wales, australia. project emphasizes safety."
win-20697,bam group,"bridge in morocco, morocco",healthcare,africa,morocco,morocco,1385.56,2023-08-05,ngo,10,carbon neutrality,fixed-price,delayed,large,"bam group secured a healthcare large-scale contract to build a stadium in morocco, morocco. project emphasizes innovation."
win-20698,mortenson construction,"power plant in victoria, australia",industrial,australia,australia,victoria,319.54,2021-05-26,ngo,42,green building,fixed-price,cancelled,medium,"mortenson construction secured a industrial medium-scale contract to build a bridge in victoria, australia. project emphasizes safety."
win-20699,larsen & toubro,"port in spain, spain",residential,europe,spain,spain,5482.06,2024-07-07,international agency,72,community engagement,time and materials,on hold,mega,"larsen & toubro secured a residential mega-scale contract to build a dam in spain, spain. project emphasizes innovation."
win-20700,jacobs,"airport in kuwait, kuwait",transportation,middle east,kuwait,kuwait,388.6,2022-02-16,government,48,renewable energy,cost-plus,on hold,medium,"jacobs secured a transportation medium-scale contract to build a data center in kuwait, kuwait. project emphasizes innovation."
win-20701,saipem,"stadium in new south wales, australia",education,australia,australia,new south wales,38.08,2021-08-23,international agency,64,unknown,cost-plus,on hold,small,"saipem secured a education small-scale contract to build a airport in new south wales, australia. project emphasizes safety."
win-20702,mace group,"smart city in egypt, egypt",industrial,africa,egypt,egypt,975.92,2022-11-23,state-owned enterprise,37,community engagement,fixed-price,delayed,large,"mace group secured a industrial large-scale contract to build a highway in egypt, egypt. project emphasizes sustainability."
win-20703,ferrovial,"railway in british columbia, canada",commercial,north america,canada,british columbia,60.19,2021-06-24,ngo,34,renewable energy,time and materials,completed,small,"ferrovial secured a commercial small-scale contract to build a data center in british columbia, canada. project emphasizes innovation."
win-20704,hochtief,"data center in guangdong, china",transportation,asia-pacific,china,guangdong,1070.11,2021-04-04,private developer,61,community engagement,cost-plus,on track,large,"hochtief secured a transportation large-scale contract to build a metro system in guangdong, china. project emphasizes innovation."
win-20705,larsen & toubro,"stadium in sweden, sweden",education,europe,sweden,sweden,6024.6849999999995,2021-11-21,public-private partnership,82,water conservation,time and materials,completed,mega,"larsen & toubro secured a education mega-scale contract to build a railway in sweden, sweden. project emphasizes innovation."
win-20706,balfour beatty,"oil pipeline in colombia, colombia",industrial,latin america,colombia,colombia,2956.73,2022-07-31,state-owned enterprise,28,water conservation,cost-plus,cancelled,mega,"balfour beatty secured a industrial mega-scale contract to build a stadium in colombia, colombia. project emphasizes sustainability."
win-20707,kajima corporation,"refinery in tamil nadu, india",infrastructure,asia-pacific,india,tamil nadu,62.4,2025-04-27,state-owned enterprise,19,water conservation,unit price,cancelled,small,"kajima corporation secured a infrastructure small-scale contract to build a dam in tamil nadu, india. project emphasizes innovation."
win-20708,bam group,"airport in indonesia, indonesia",infrastructure,asia-pacific,indonesia,indonesia,393.92,2020-06-01,state-owned enterprise,11,green building,fixed-price,completed,medium,"bam group secured a infrastructure medium-scale contract to build a wind farm in indonesia, indonesia. project emphasizes innovation."
win-20709,samsung c&t,"metro system in mexico, mexico",industrial,north america,mexico,mexico,60.03,2021-04-24,public-private partnership,75,renewable energy,fixed-price,on hold,small,"samsung c&t secured a industrial small-scale contract to build a railway in mexico, mexico. project emphasizes sustainability."
win-20710,vinci,"wind farm in england, uk",energy,europe,uk,england,2309.29,2025-05-06,private developer,33,unknown,unit price,on track,mega,"vinci secured a energy mega-scale contract to build a wind farm in england, uk. project emphasizes digitalization."
win-20711,mace group,"hospital in nigeria, nigeria",transportation,africa,nigeria,nigeria,1864.27,2020-06-13,government,19,green building,cost-plus,on hold,large,"mace group secured a transportation large-scale contract to build a solar plant in nigeria, nigeria. project emphasizes safety."
win-20712,snc-lavalin,"hospital in south korea, south korea",energy,asia-pacific,south korea,south korea,84.46,2024-08-26,government,32,unknown,fixed-price,on hold,small,"snc-lavalin secured a energy small-scale contract to build a solar plant in south korea, south korea. project emphasizes safety."
win-20713,vinci,"airport in venezuela, venezuela",healthcare,latin america,venezuela,venezuela,875.59,2021-09-18,private developer,32,green building,unit price,cancelled,large,"vinci secured a healthcare large-scale contract to build a refinery in venezuela, venezuela. project emphasizes digitalization."
win-20714,aecom,"high-rise building in indonesia, indonesia",commercial,asia-pacific,indonesia,indonesia,414.08,2025-04-06,municipality,31,waste reduction,cost-plus,on hold,medium,"aecom secured a commercial medium-scale contract to build a metro system in indonesia, indonesia. project emphasizes community impact."
win-20715,john holland,"port in saudi arabia, saudi arabia",commercial,middle east,saudi arabia,saudi arabia,19.96,2023-12-27,ngo,77,green building,fixed-price,delayed,small,"john holland secured a commercial small-scale contract to build a railway in saudi arabia, saudi arabia. project emphasizes safety."
win-20716,laing o’rourke,"warehouse in illinois, usa",utilities,north america,usa,illinois,888.42,2024-07-05,corporate,32,carbon neutrality,unit price,cancelled,large,"laing o’rourke secured a utilities large-scale contract to build a railway in illinois, usa. project emphasizes safety."
win-20717,multiplex,"metro system in argentina, argentina",industrial,latin america,argentina,argentina,3626.78,2025-03-27,state-owned enterprise,72,carbon neutrality,unit price,on hold,mega,"multiplex secured a industrial mega-scale contract to build a power plant in argentina, argentina. project emphasizes safety."
win-20718,john holland,"university campus in netherlands, netherlands",industrial,europe,netherlands,netherlands,78.58,2022-05-31,state-owned enterprise,45,green building,lump sum,cancelled,small,"john holland secured a industrial small-scale contract to build a highway in netherlands, netherlands. project emphasizes innovation."
win-20719,john holland,"stadium in morocco, morocco",industrial,africa,morocco,morocco,4532.27,2024-02-24,utility company,22,unknown,lump sum,completed,mega,"john holland secured a industrial mega-scale contract to build a residential complex in morocco, morocco. project emphasizes safety."
win-20720,kajima corporation,"refinery in kwazulu-natal, south africa",industrial,africa,south africa,kwazulu-natal,6024.6849999999995,2024-08-27,state-owned enterprise,52,carbon neutrality,fixed-price,cancelled,mega,"kajima corporation secured a industrial mega-scale contract to build a residential complex in kwazulu-natal, south africa. project emphasizes digitalization."
win-20721,strabag,"university campus in kuwait, kuwait",transportation,middle east,kuwait,kuwait,18.67,2021-10-14,corporate,61,community engagement,lump sum,completed,small,"strabag secured a transportation small-scale contract to build a wind farm in kuwait, kuwait. project emphasizes safety."
win-20722,ferrovial,"shopping mall in argentina, argentina",industrial,latin america,argentina,argentina,465.29,2023-01-06,private developer,62,community engagement,cost-plus,delayed,medium,"ferrovial secured a industrial medium-scale contract to build a port in argentina, argentina. project emphasizes sustainability."
win-20723,kiewit,"railway in british columbia, canada",education,north america,canada,british columbia,25.97,2023-10-08,corporate,31,carbon neutrality,cost-plus,completed,small,"kiewit secured a education small-scale contract to build a airport in british columbia, canada. project emphasizes community impact."
win-20724,larsen & toubro,"solar plant in victoria, australia",healthcare,australia,australia,victoria,320.49,2021-07-11,private developer,73,community engagement,fixed-price,on hold,medium,"larsen & toubro secured a healthcare medium-scale contract to build a highway in victoria, australia. project emphasizes sustainability."
win-20725,shimizu corporation,"highway in oman, oman",industrial,middle east,oman,oman,36.91,2023-07-04,public-private partnership,33,renewable energy,lump sum,cancelled,small,"shimizu corporation secured a industrial small-scale contract to build a refinery in oman, oman. project emphasizes community impact."
win-20726,strabag,"smart city in egypt, egypt",transportation,africa,egypt,egypt,74.52,2023-05-08,utility company,62,water conservation,lump sum,completed,small,"strabag secured a transportation small-scale contract to build a shopping mall in egypt, egypt. project emphasizes sustainability."
win-20727,gilbane,"bridge in colombia, colombia",utilities,latin america,colombia,colombia,32.23,2024-03-17,international agency,9,unknown,lump sum,completed,small,"gilbane secured a utilities small-scale contract to build a railway in colombia, colombia. project emphasizes innovation."
win-20728,mortenson construction,"hospital in mexico, mexico",energy,north america,mexico,mexico,224.03,2021-04-10,municipality,63,community engagement,unit price,on track,medium,"mortenson construction secured a energy medium-scale contract to build a solar plant in mexico, mexico. project emphasizes digitalization."
win-20729,saipem,"power plant in karnataka, india",education,asia-pacific,india,karnataka,1290.32,2022-06-26,corporate,36,green building,unit price,on track,large,"saipem secured a education large-scale contract to build a high-rise building in karnataka, india. project emphasizes sustainability."
win-20730,obayashi corporation,"wind farm in colombia, colombia",healthcare,latin america,colombia,colombia,4170.3,2020-12-23,corporate,80,green building,unit price,on hold,mega,"obayashi corporation secured a healthcare mega-scale contract to build a oil pipeline in colombia, colombia. project emphasizes safety."
win-20731,lendlease,"data center in egypt, egypt",energy,africa,egypt,egypt,269.72,2023-03-29,utility company,47,waste reduction,lump sum,on track,medium,"lendlease secured a energy medium-scale contract to build a port in egypt, egypt. project emphasizes sustainability."
win-20732,multiplex,"school in kuwait, kuwait",healthcare,middle east,kuwait,kuwait,95.21,2025-05-09,state-owned enterprise,36,water conservation,time and materials,delayed,small,"multiplex secured a healthcare small-scale contract to build a shopping mall in kuwait, kuwait. project emphasizes safety."
win-20733,bam group,"airport in wales, uk",residential,europe,uk,wales,301.51,2020-11-01,ngo,10,unknown,fixed-price,on hold,medium,"bam group secured a residential medium-scale contract to build a school in wales, uk. project emphasizes sustainability."
win-20734,china state construction,"hospital in california, usa",residential,north america,usa,california,5334.65,2021-08-04,private developer,82,water conservation,lump sum,on track,mega,"china state construction secured a residential mega-scale contract to build a university campus in california, usa. project emphasizes innovation."
win-20735,bechtel,"metro system in oman, oman",education,middle east,oman,oman,1101.65,2021-04-22,state-owned enterprise,49,green building,fixed-price,on track,large,"bechtel secured a education large-scale contract to build a power plant in oman, oman. project emphasizes safety."
win-20736,mccarthy,"data center in queensland, australia",transportation,australia,australia,queensland,68.33,2025-01-09,ngo,27,waste reduction,time and materials,cancelled,small,"mccarthy secured a transportation small-scale contract to build a solar plant in queensland, australia. project emphasizes digitalization."
win-20737,skanska,"airport in karnataka, india",healthcare,asia-pacific,india,karnataka,2250.74,2022-05-22,utility company,28,water conservation,time and materials,cancelled,mega,"skanska secured a healthcare mega-scale contract to build a residential complex in karnataka, india. project emphasizes innovation."
win-20738,bechtel,"power plant in venezuela, venezuela",infrastructure,latin america,venezuela,venezuela,1210.67,2022-09-07,state-owned enterprise,15,waste reduction,cost-plus,on track,large,"bechtel secured a infrastructure large-scale contract to build a airport in venezuela, venezuela. project emphasizes safety."
